{
  "schemaVersion": 1,
  "sample": true,
  "whatIsThis": "Customized official installer ISO. isomill injected native install configuration into official upstream media. This is not a Fedora or Ubuntu remix authored by isomill. THIS RECORD IS A SAMPLE FIXTURE, NOT A LIVE ISO.",
  "generatedBy": {
    "project": "isomill",
    "homepage": "https://isomill.dev",
    "sourceRepo": "https://github.com/BVisagie/isomill",
    "version": "0.1.0",
    "gitCommit": "sample"
  },
  "upstreamIso": {
    "distribution": "fedora",
    "release": "44",
    "filename": "Fedora-Everything-netinst-x86_64-44-1.5.iso",
    "downloadUrl": "https://download.fedoraproject.org/pub/fedora/linux/releases/44/Everything/x86_64/iso/Fedora-Everything-netinst-x86_64-44-1.5.iso",
    "checksumAlgorithm": "sha256",
    "checksumValue": "not-verified",
    "checksumUrl": "https://download.fedoraproject.org/pub/fedora/linux/releases/44/Everything/x86_64/iso/Fedora-Everything-x86_64-44-1.5-CHECKSUM",
    "signatureVerified": false,
    "gpgKeyUrl": "https://fedoraproject.org/fedora.gpg"
  },
  "configuration": {
    "installCfgDigest": "sha256:sample",
    "machineDefinitionDigest": "sha256:sample",
    "adapter": "kickstart"
  },
  "catalogue": {
    "version": "1.0.0",
    "digest": "sha256:sample"
  },
  "repositories": [
    {
      "kind": "distro",
      "url": "https://download.fedoraproject.org/",
      "publisher": "Fedora"
    },
    {
      "kind": "vendor",
      "url": "https://packages.microsoft.com/yumrepos/vscode",
      "publisher": "Microsoft",
      "keyUrl": "https://packages.microsoft.com/keys/microsoft.asc",
      "packages": ["code"]
    },
    {
      "kind": "npm",
      "url": "https://registry.npmjs.org",
      "publisher": "Anthropic",
      "packages": ["@anthropic-ai/claude-code"]
    }
  ],
  "npmDisclaimer": "npm packages in this configuration are an isomill policy allowlist. They are not signature-verified the way Fedora or Ubuntu packages are. They were configured to install with npm install -g --ignore-scripts.",
  "sourceGraph": []
}
